[
  {
    "description": "Stone Colossus Innards",
    "filename": "TheColossalHeart",
    "mark": "Colossus",
    "metadata": {
      "albumArtist": "Wizet",
      "artist": "StudioEIM",
      "title": "The Colossal Heart",
      "year": "2013"
    },
    "source": {
      "client": "KMST",
      "date": "2013-04-18",
      "structure": "Bgm32",
      "version": "1.2.476"
    },
    "youtube": "hX73YhOINKA"
  },
  {
    "description": "Stone Colossus Body",
    "filename": "TheLivingMountain",
    "mark": "Colossus",
    "metadata": {
      "albumArtist": "Wizet",
      "artist": "StudioEIM",
      "title": "The Living Mountain",
      "year": "2013"
    },
    "source": {
      "client": "KMST",
      "date": "2013-04-18",
      "structure": "Bgm32",
      "version": "1.2.476"
    },
    "youtube": "sW2zoOX8iUc"
  },
  {
    "description": "Stone Colossus",
    "filename": "TheRaiders",
    "mark": "Colossus",
    "metadata": {
      "albumArtist": "Wizet",
      "artist": "StudioEIM",
      "title": "The Raiders",
      "year": "2013"
    },
    "source": {
      "client": "KMST",
      "date": "2013-04-18",
      "structure": "Bgm32",
      "version": "1.2.476"
    },
    "youtube": "mVR37_LjJUk"
  },
  {
    "description": "Survival event minigame",
    "filename": "TheRush",
    "mark": "MinigameStation",
    "metadata": {
      "albumArtist": "Wizet",
      "artist": "StudioEIM",
      "title": "The Rush",
      "year": "2013"
    },
    "source": {
      "client": "KMST",
      "date": "2013-04-18",
      "structure": "Bgm32",
      "version": "1.2.476"
    },
    "youtube": "8DzLlqjEnxc"
  }
]
