[
  {
    "description": "Evolution System",
    "filename": "EvolvingWorld",
    "mark": "EvolvingSystem",
    "metadata": {
      "albumArtist": "Wizet",
      "artist": "StudioEIM",
      "title": "Evolving World",
      "year": "2012"
    },
    "source": {
      "client": "KMST",
      "date": "2012-09-13",
      "structure": "Bgm17",
      "version": "1.2.450"
    },
    "youtube": "0WLtsCqEQ4Q"
  },
  {
    "description": "Gold Beach",
    "filename": "GoldBeach",
    "mark": "Goldrich",
    "metadata": {
      "albumArtist": "Wizet",
      "artist": "StudioEIM",
      "title": "Gold Beach",
      "year": "2012"
    },
    "source": {
      "client": "KMS",
      "date": "2012-11-15",
      "structure": "Bgm17",
      "version": "1.2.178"
    },
    "youtube": "pyxpWEl3St0"
  },
  {
    "description": "Mu Lung Dojo First Tier, Foggy Forest Training Center",
    "filename": "MureungSchool1",
    "mark": "ForestTraining",
    "metadata": {
      "albumArtist": "Wizet",
      "artist": "StudioEIM",
      "title": "Mu Lung Raid 1",
      "year": "2008"
    },
    "source": {
      "client": "KMST",
      "date": "2008-09-18",
      "structure": "Bgm17",
      "version": "1.2.163"
    },
    "youtube": "bqR0o6TkkQk"
  },
  {
    "description": "Mu Lung Dojo Second Tier",
    "filename": "MureungSchool2",
    "mark": "MuruengRaid",
    "metadata": {
      "albumArtist": "Wizet",
      "artist": "StudioEIM",
      "title": "Mu Lung Raid 2",
      "year": "2008"
    },
    "source": {
      "client": "KMST",
      "date": "2008-09-18",
      "structure": "Bgm17",
      "version": "1.2.163"
    },
    "youtube": "cypwlFD2TE4"
  },
  {
    "description": "Mu Lung Dojo Third Tier",
    "filename": "MureungSchool3",
    "mark": "MuruengRaid",
    "metadata": {
      "albumArtist": "Wizet",
      "artist": "StudioEIM",
      "title": "Mu Lung Raid 3",
      "year": "2008"
    },
    "source": {
      "client": "KMST",
      "date": "2008-09-18",
      "structure": "Bgm17",
      "version": "1.2.163"
    },
    "youtube": "9SKZBsjUdAg"
  },
  {
    "description": "Mu Lung Dojo Final Tier",
    "filename": "MureungSchool4",
    "mark": "MuruengRaid",
    "metadata": {
      "albumArtist": "Wizet",
      "artist": "StudioEIM",
      "title": "Mu Lung Raid 4",
      "year": "2008"
    },
    "source": {
      "client": "KMST",
      "date": "2008-09-18",
      "structure": "Bgm17",
      "version": "1.2.163"
    },
    "youtube": "44UN_MwwAEg"
  },
  {
    "description": "Kerning City: The Secret Garden",
    "filename": "secretFlower",
    "mark": "SecretFlower",
    "metadata": {
      "albumArtist": "Wizet",
      "artist": "StudioEIM",
      "title": "Secret Flower",
      "year": "2010"
    },
    "source": {
      "client": "KMST",
      "date": "2010-02-23",
      "structure": "Bgm17",
      "version": "1.2.294"
    },
    "youtube": "C0xN8QcxqXk"
  }
]
