[
  {
    "decoration": {
      "minorTrack": true
    },
    "description": "Mo Xuan's Unleashed Energy skill",
    "filename": "5thHyunsanpaUnleashedEnergy",
    "mark": "Hajin",
    "metadata": {
      "albumArtist": "NECORD",
      "artist": "ASTERIA",
      "title": "Unleashed Energy",
      "year": "2021"
    },
    "source": {
      "client": "CMST",
      "date": "2021-02-02",
      "structure": "BgmMH",
      "version": "1.67"
    },
    "youtube": "EQaK1VqKktE"
  },
  {
    "description": "Mo Xuan storyline",
    "filename": "Fate",
    "mark": "Hajin",
    "metadata": {
      "albumArtist": "NECORD",
      "artist": "ASTERIA",
      "title": "Fate",
      "year": "2021"
    },
    "source": {
      "client": "CMST",
      "date": "2021-02-02",
      "structure": "BgmMH",
      "version": "1.67"
    },
    "youtube": "z-ZtDeDsCpA"
  },
  {
    "description": "Mo Xuan storyline",
    "filename": "GodOfWar",
    "mark": "Hajin",
    "metadata": {
      "albumArtist": "NECORD",
      "artist": "ASTERIA",
      "title": "God of War",
      "year": "2021"
    },
    "source": {
      "client": "CMST",
      "date": "2021-02-02",
      "structure": "BgmMH",
      "version": "1.67"
    },
    "youtube": "DbaFuwqTO1s"
  },
  {
    "description": "Jianghu: Hejin",
    "filename": "Hajin",
    "mark": "Hajin",
    "metadata": {
      "albumArtist": "NECORD",
      "artist": "ASTERIA",
      "title": "Hejin",
      "year": "2021"
    },
    "source": {
      "client": "CMST",
      "date": "2021-02-02",
      "structure": "BgmMH",
      "version": "1.67"
    },
    "youtube": "DuO0_fZkHCI"
  },
  {
    "description": "Jianghu: Xuan Mountain",
    "filename": "Hyunsan",
    "mark": "Hajin",
    "metadata": {
      "albumArtist": "NECORD",
      "artist": "ASTERIA",
      "title": "Xuan Mountain",
      "year": "2021"
    },
    "source": {
      "client": "CMST",
      "date": "2021-02-02",
      "structure": "BgmMH",
      "version": "1.67"
    },
    "youtube": "5cbxigyRMaY"
  },
  {
    "description": "Jianghu: Xuan Mountain School",
    "filename": "Hyunsanpa",
    "mark": "Hajin",
    "metadata": {
      "albumArtist": "NECORD",
      "artist": "ASTERIA",
      "title": "Xuan Mountain School",
      "year": "2021"
    },
    "source": {
      "client": "CMST",
      "date": "2021-02-02",
      "structure": "BgmMH",
      "version": "1.67"
    },
    "youtube": "6ugjjd7HaD4"
  },
  {
    "description": "Mo Xuan storyline",
    "filename": "Indomitable",
    "mark": "Hajin",
    "metadata": {
      "albumArtist": "NECORD",
      "artist": "ASTERIA",
      "title": "Indomitable",
      "year": "2021"
    },
    "source": {
      "client": "CMST",
      "date": "2021-02-02",
      "structure": "BgmMH",
      "version": "1.67"
    },
    "youtube": "TA3zWgdk-qk"
  },
  {
    "description": "Jianghu: Valley of Flames",
    "filename": "Threat",
    "mark": "Hajin",
    "metadata": {
      "albumArtist": "NECORD",
      "artist": "ASTERIA",
      "title": "Threat",
      "year": "2021"
    },
    "source": {
      "client": "CMST",
      "date": "2021-02-02",
      "structure": "BgmMH",
      "version": "1.67"
    },
    "youtube": "hS-QrEDtxuM"
  }
]
