[
  {
    "description": "Lynn storyline",
    "filename": "DeerMyDear",
    "mark": "ForestofEternity",
    "metadata": {
      "albumArtist": "NECORD",
      "artist": "ASTERIA",
      "title": "Deer My Dear",
      "year": "2024"
    },
    "source": {
      "client": "TMS",
      "date": "2024-02-21",
      "structure": "BgmLYNN",
      "version": "2.59"
    },
    "youtube": "1IjkMl4uvow"
  },
  {
    "description": "Lynn storyline",
    "filename": "EmptyWishes",
    "mark": "ForestofEternity",
    "metadata": {
      "albumArtist": "NECORD",
      "artist": "ASTERIA",
      "title": "Empty Wishes",
      "year": "2024"
    },
    "source": {
      "client": "TMS",
      "date": "2024-02-21",
      "structure": "BgmLYNN",
      "version": "2.59"
    },
    "youtube": "V0K-Iqk10w8"
  },
  {
    "description": "Forest of Eternity field",
    "filename": "IntoTheWoods",
    "mark": "ForestofEternity",
    "metadata": {
      "albumArtist": "NECORD",
      "artist": "ASTERIA",
      "title": "Into the Woods",
      "year": "2024"
    },
    "source": {
      "client": "TMS",
      "date": "2024-02-21",
      "structure": "BgmLYNN",
      "version": "2.59"
    },
    "youtube": "ZYOHMiayA7k"
  },
  {
    "description": "Forest of Eternity: Forest Entrance Cabin",
    "filename": "MyLittleCottage",
    "mark": "ForestofEternity",
    "metadata": {
      "albumArtist": "NECORD",
      "artist": "ASTERIA",
      "title": "My Little Cottage",
      "year": "2024"
    },
    "source": {
      "client": "TMS",
      "date": "2024-02-21",
      "structure": "BgmLYNN",
      "version": "2.59"
    },
    "youtube": "eZiLN1NBahU"
  },
  {
    "description": "Forest of Eternity: Fountain of Reincarnation",
    "filename": "OurStoryGoesOn",
    "mark": "ForestofEternity",
    "metadata": {
      "albumArtist": "NECORD",
      "artist": "ASTERIA",
      "title": "Our Story Goes On",
      "year": "2024"
    },
    "source": {
      "client": "TMS",
      "date": "2024-02-21",
      "structure": "BgmLYNN",
      "version": "2.59"
    },
    "youtube": "ky0dsOW2tZY"
  },
  {
    "description": "Forest of Eternity: Sea Cliff",
    "filename": "SomewhereBeyondTheCliff",
    "mark": "ForestofEternity",
    "metadata": {
      "albumArtist": "NECORD",
      "artist": "ASTERIA",
      "title": "Somewhere Beyond the Cliff",
      "year": "2024"
    },
    "source": {
      "client": "TMS",
      "date": "2024-02-21",
      "structure": "BgmLYNN",
      "version": "2.59"
    },
    "youtube": "oebLavw3F4M"
  },
  {
    "description": "Forest of Eternity field",
    "filename": "WhispersOfTheTrees",
    "mark": "ForestofEternity",
    "metadata": {
      "albumArtist": "NECORD",
      "artist": "ASTERIA",
      "title": "Whispers of the Trees",
      "year": "2024"
    },
    "source": {
      "client": "TMS",
      "date": "2024-02-21",
      "structure": "BgmLYNN",
      "version": "2.59"
    },
    "youtube": "VuawsyejZVc"
  }
]
