[
  {
    "description": "Ariant",
    "filename": "Ariant",
    "mark": "Ariant",
    "metadata": {
      "albumArtist": "Wizet",
      "artist": "StudioEIM",
      "title": "Ariant",
      "year": "2007"
    },
    "source": {
      "client": "KMST",
      "date": "2007-04-06",
      "structure": "Bgm14",
      "version": "1.2.80"
    },
    "youtube": "w1RgDSoOajw"
  },
  {
    "description": "Hot Desert (Old Version)",
    "filename": "Burningroad",
    "mark": "Ariant",
    "metadata": {
      "albumArtist": "Wizet",
      "artist": "StudioEIM",
      "title": "Burning Road",
      "year": "2007"
    },
    "source": {
      "client": "KMST",
      "date": "2007-04-06",
      "structure": "Bgm14",
      "version": "1.2.80"
    },
    "youtube": "dPK41O2-odk"
  },
  {
    "description": "Leafre: Cave of Life",
    "filename": "CaveOfHontale",
    "mark": "Leafre",
    "metadata": {
      "albumArtist": "Wizet",
      "artist": "StudioEIM",
      "title": "Cave of Horntail",
      "year": "2006"
    },
    "source": {
      "client": "KMS",
      "date": "2006-09-27",
      "structure": "Bgm14",
      "version": "1.2.32"
    },
    "youtube": "Lo59n_tMGSM"
  },
  {
    "description": "Leafre: Dragon Forest",
    "filename": "DragonLoad",
    "mark": "Leafre",
    "metadata": {
      "albumArtist": "Wizet",
      "artist": "StudioEIM",
      "title": "Dragon Load",
      "year": "2006"
    },
    "source": {
      "client": "KMS",
      "date": "2006-08-24",
      "structure": "Bgm14",
      "version": "1.2.31"
    },
    "youtube": "z3jhg8KffPI"
  },
  {
    "description": "Leafre: Dragon Canyon",
    "filename": "DragonNest",
    "mark": "Leafre",
    "metadata": {
      "albumArtist": "Wizet",
      "artist": "StudioEIM",
      "title": "Dragon's Nest",
      "year": "2006"
    },
    "source": {
      "client": "KMS",
      "date": "2006-09-27",
      "structure": "Bgm14",
      "version": "1.2.32"
    },
    "youtube": "Dsis2wyHQD0"
  },
  {
    "description": "Dragon Rider Party Quest",
    "filename": "DragonRider",
    "mark": "Dragonrider",
    "metadata": {
      "albumArtist": "Wizet",
      "artist": "StudioEIM",
      "title": "Dragon Rider",
      "year": "2009"
    },
    "source": {
      "client": "KMST",
      "date": "2009-12-21",
      "structure": "Bgm14",
      "version": "1.2.275"
    },
    "youtube": "s6zoD2gnYrA"
  },
  {
    "description": "Horntail boss theme",
    "filename": "HonTale",
    "mark": "Hontale",
    "metadata": {
      "albumArtist": "Wizet",
      "artist": "StudioEIM",
      "title": "Horntail",
      "year": "2006"
    },
    "source": {
      "client": "KMS",
      "date": "2006-09-27",
      "structure": "Bgm14",
      "version": "1.2.32"
    },
    "youtube": "WnLrTMmnyBc"
  },
  {
    "description": "Ariant field",
    "filename": "HotDesert",
    "mark": "Ariant",
    "metadata": {
      "albumArtist": "Wizet",
      "artist": "StudioEIM",
      "title": "Hot Desert",
      "year": "2007"
    },
    "source": {
      "client": "KMST",
      "date": "2007-04-13",
      "structure": "Bgm14",
      "version": "1.2.81"
    },
    "youtube": "q9swmo6309U"
  }
]
