[
  {
    "description": "Pantheon: Angelic Buster's Room",
    "filename": "AngelsRoom",
    "mark": "Pantheon",
    "metadata": {
      "albumArtist": "Wizet",
      "artist": "StudioEIM",
      "title": "Angel's Room",
      "year": "2012"
    },
    "source": {
      "client": "KMST",
      "date": "2012-08-10",
      "structure": "Bgm27",
      "version": "1.2.445"
    },
    "youtube": "EC56KZErScE"
  },
  {
    "description": "Pantheon: Suspicious Hideout, Heretic Temple",
    "filename": "BaseOfBetrayers",
    "mark": "Pantheon",
    "metadata": {
      "albumArtist": "Wizet",
      "artist": "StudioEIM",
      "title": "Base of Betrayers",
      "year": "2012"
    },
    "source": {
      "client": "KMST",
      "date": "2012-07-18",
      "structure": "Bgm27",
      "version": "1.2.439"
    },
    "youtube": "TeFx8yrpzHc"
  },
  {
    "description": "Pantheon border area",
    "filename": "BorderArea",
    "mark": "Pantheon",
    "metadata": {
      "albumArtist": "Wizet",
      "artist": "StudioEIM",
      "title": "Border Area",
      "year": "2012"
    },
    "source": {
      "client": "KMST",
      "date": "2012-07-18",
      "structure": "Bgm27",
      "version": "1.2.439"
    },
    "youtube": "cxqCXm9_LsI"
  },
  {
    "description": "Pantheon: Great Temple",
    "filename": "GreatTemple",
    "mark": "Pantheon",
    "metadata": {
      "albumArtist": "Wizet",
      "artist": "StudioEIM",
      "title": "Great Temple",
      "year": "2012"
    },
    "source": {
      "client": "KMST",
      "date": "2012-07-18",
      "structure": "Bgm27",
      "version": "1.2.439"
    },
    "youtube": "CZTQdmJAEQI"
  },
  {
    "description": "Pantheon Sanctum",
    "filename": "NovaSanctum",
    "mark": "Pantheon",
    "metadata": {
      "albumArtist": "Wizet",
      "artist": "StudioEIM",
      "title": "Nova Sanctum",
      "year": "2012"
    },
    "source": {
      "client": "KMST",
      "date": "2012-07-18",
      "structure": "Bgm27",
      "version": "1.2.439"
    },
    "youtube": "NNh-dYY3MpM"
  },
  {
    "description": "Pantheon",
    "filename": "Pantheon",
    "mark": "Pantheon",
    "metadata": {
      "albumArtist": "Wizet",
      "artist": "StudioEIM",
      "title": "Pantheon",
      "year": "2012"
    },
    "source": {
      "client": "KMST",
      "date": "2012-07-18",
      "structure": "Bgm27",
      "version": "1.2.439"
    },
    "youtube": "ZYeUnqsCnxg"
  },
  {
    "description": "Pantheon field",
    "filename": "PantheonField",
    "mark": "Pantheon",
    "metadata": {
      "albumArtist": "Wizet",
      "artist": "StudioEIM",
      "title": "Pantheon Field",
      "year": "2012"
    },
    "source": {
      "client": "KMST",
      "date": "2012-07-18",
      "structure": "Bgm27",
      "version": "1.2.439"
    },
    "youtube": "Koxm5dEtkS8"
  },
  {
    "description": "Kaiser tutorial",
    "filename": "StepOfKaiser",
    "mark": "Pantheon",
    "metadata": {
      "albumArtist": "Wizet",
      "artist": "StudioEIM",
      "title": "Step of Kaiser",
      "year": "2012"
    },
    "source": {
      "client": "KMST",
      "date": "2012-07-18",
      "structure": "Bgm27",
      "version": "1.2.439"
    },
    "youtube": "r05cGa1Jms0"
  },
  {
    "description": "Kaiser tutorial",
    "filename": "TrappedKaiser",
    "mark": "Pantheon",
    "metadata": {
      "albumArtist": "Wizet",
      "artist": "StudioEIM",
      "title": "Trapped Kaiser",
      "year": "2012"
    },
    "source": {
      "client": "KMST",
      "date": "2012-07-18",
      "structure": "Bgm27",
      "version": "1.2.439"
    },
    "youtube": "TNcUGCElU40"
  }
]
