[
  {
    "description": "Oort: Star Garden",
    "filename": "FalterMindBecameAStarlight",
    "mark": "GL_Oort",
    "metadata": {
      "albumArtist": "NECORD",
      "artist": "ASTERIA",
      "title": "Falter Mind Became a Starlight",
      "year": "2025"
    },
    "source": {
      "client": "GMS",
      "date": "2025-06-11",
      "structure": "GL_Sia",
      "version": "2.60"
    },
    "youtube": "6JL2Y8e1d4Q"
  },
  {
    "description": "Oort: Star Forest",
    "filename": "FateForest",
    "mark": "GL_Oort",
    "metadata": {
      "albumArtist": "NECORD",
      "artist": "ASTERIA",
      "title": "Fate Forest",
      "year": "2025"
    },
    "source": {
      "client": "GMS",
      "date": "2025-06-11",
      "structure": "GL_Sia",
      "version": "2.60"
    },
    "youtube": "AsJ2ehBy1es"
  },
  {
    "description": "Perion: Astronomy Lab",
    "filename": "FriendBecameAStar",
    "mark": "GL_OortLab",
    "metadata": {
      "albumArtist": "NECORD",
      "artist": "ASTERIA",
      "title": "Friend Became a Star",
      "year": "2025"
    },
    "source": {
      "client": "GMS",
      "date": "2025-06-11",
      "structure": "GL_Sia",
      "version": "2.60"
    },
    "youtube": "GDkTZp0ucZE"
  },
  {
    "description": "Oort: Sea of Darkened Stars",
    "filename": "GraveyardOfTheStar",
    "mark": "GL_Oort",
    "metadata": {
      "albumArtist": "NECORD",
      "artist": "ASTERIA",
      "title": "Graveyard of the Star",
      "year": "2025"
    },
    "source": {
      "client": "GMS",
      "date": "2025-06-11",
      "structure": "GL_Sia",
      "version": "2.60"
    },
    "youtube": "3kRn4NC32bE"
  },
  {
    "description": "Oort: Twinkling Valley",
    "filename": "LittleStarsHappyDelusion",
    "mark": "GL_Oort",
    "metadata": {
      "albumArtist": "NECORD",
      "artist": "ASTERIA",
      "title": "Little Star's Happy Delusion",
      "year": "2025"
    },
    "source": {
      "client": "GMS",
      "date": "2025-06-11",
      "structure": "GL_Sia",
      "version": "2.60"
    },
    "youtube": "mYvsr2eIW-k"
  },
  {
    "description": "Oort Lobby",
    "filename": "StarGuardian",
    "mark": "GL_Oort",
    "metadata": {
      "albumArtist": "NECORD",
      "artist": "ASTERIA",
      "title": "The Guardian of the Stars",
      "year": "2025"
    },
    "source": {
      "client": "GMS",
      "date": "2025-06-11",
      "structure": "GL_Sia",
      "version": "2.60"
    },
    "youtube": "fCUPkw1Dsco"
  },
  {
    "description": "Oort",
    "filename": "ThelullabyOort",
    "mark": "GL_Oort",
    "metadata": {
      "albumArtist": "NECORD",
      "artist": "ASTERIA",
      "title": "The Lullaby Oort",
      "year": "2025"
    },
    "source": {
      "client": "GMS",
      "date": "2025-06-11",
      "structure": "GL_Sia",
      "version": "2.60"
    },
    "youtube": "najOnl1mXW0"
  }
]
