[
  {
    "description": "Luminous tutorial",
    "filename": "BurningWoods",
    "mark": "Ellinia",
    "metadata": {
      "albumArtist": "Wizet",
      "artist": "StudioEIM",
      "title": "Burning Woods",
      "year": "2012"
    },
    "source": {
      "client": "KMST",
      "date": "2012-07-03",
      "structure": "Bgm26",
      "version": "1.2.437"
    },
    "youtube": "fPVOc5uau1M"
  },
  {
    "description": "Luminous tutorial, Black Mage encounter",
    "filename": "DarkMage",
    "mark": "TimeTemple",
    "metadata": {
      "albumArtist": "Wizet",
      "artist": "StudioEIM",
      "title": "Dark Mage",
      "year": "2012"
    },
    "source": {
      "client": "KMST",
      "date": "2012-07-03",
      "structure": "Bgm26",
      "version": "1.2.437"
    },
    "youtube": "PLGbYlBbw2E"
  },
  {
    "description": "Luminous storyline",
    "filename": "DarkWoods",
    "mark": "Ellinia",
    "metadata": {
      "albumArtist": "Wizet",
      "artist": "StudioEIM",
      "title": "Dark Woods",
      "year": "2012"
    },
    "source": {
      "client": "KMST",
      "date": "2012-07-03",
      "structure": "Bgm26",
      "version": "1.2.437"
    },
    "youtube": "ekBYanDkybM"
  },
  {
    "description": "Luminous tutorial, Black Mage's Temple",
    "filename": "FinalFight (Tempest)",
    "mark": "TimeTemple",
    "metadata": {
      "albumArtist": "Wizet",
      "artist": "StudioEIM",
      "title": "Final Fight",
      "year": "2012"
    },
    "source": {
      "client": "KMST",
      "date": "2012-07-03",
      "structure": "Bgm26",
      "version": "1.2.437"
    },
    "youtube": "R5dUCq4vnvk"
  },
  {
    "description": "Luminous tutorial",
    "filename": "Flood",
    "mark": "Ellinia",
    "metadata": {
      "albumArtist": "Wizet",
      "artist": "StudioEIM",
      "title": "Flood",
      "year": "2012"
    },
    "source": {
      "client": "KMST",
      "date": "2012-07-03",
      "structure": "Bgm26",
      "version": "1.2.437"
    },
    "youtube": "1cipH9qIEow"
  },
  {
    "description": "Luminous tutorial",
    "filename": "PeacefulWoods",
    "mark": "Ellinia",
    "metadata": {
      "albumArtist": "Wizet",
      "artist": "StudioEIM",
      "title": "Peaceful Woods",
      "year": "2012"
    },
    "source": {
      "client": "KMST",
      "date": "2012-07-03",
      "structure": "Bgm26",
      "version": "1.2.437"
    },
    "youtube": "6BqN9qhPoGQ"
  },
  {
    "description": "Luminous storyline",
    "filename": "Serenity",
    "mark": "Ellinia",
    "metadata": {
      "albumArtist": "Wizet",
      "artist": "StudioEIM",
      "title": "Serenity",
      "year": "2012"
    },
    "source": {
      "client": "KMST",
      "date": "2012-07-03",
      "structure": "Bgm26",
      "version": "1.2.437"
    },
    "youtube": "bDKPdN8rUko"
  },
  {
    "description": "Luminous tutorial",
    "filename": "SpeakInTheVoid",
    "mark": "TimeTemple",
    "metadata": {
      "albumArtist": "Wizet",
      "artist": "StudioEIM",
      "title": "Speak in the Void",
      "year": "2012"
    },
    "source": {
      "client": "KMST",
      "date": "2012-07-03",
      "structure": "Bgm26",
      "version": "1.2.437"
    },
    "youtube": "0-ANvxookZ0"
  }
]
