[
  {
    "description": "Orbis Tower",
    "filename": "ComeWithMe",
    "mark": "Orbis",
    "metadata": {
      "albumArtist": "Wizet",
      "artist": "StudioEIM",
      "title": "Come With Me",
      "year": "2004"
    },
    "source": {
      "client": "KMS",
      "date": "2004-04-22",
      "structure": "Bgm06",
      "version": "1.60"
    },
    "youtube": "sNCwJu5Buz0"
  },
  {
    "description": "Ludibrium",
    "filename": "FantasticThinking",
    "mark": "Ludibrium",
    "metadata": {
      "albumArtist": "Wizet",
      "artist": "StudioEIM",
      "title": "Fantastic Thinking",
      "year": "2004"
    },
    "source": {
      "client": "KMS",
      "date": "2004-12-20",
      "structure": "Bgm06",
      "version": "1.81"
    },
    "youtube": "49AZqVhXVeU"
  },
  {
    "description": "Zakum boss theme",
    "filename": "FinalFight",
    "mark": "Zakum",
    "metadata": {
      "albumArtist": "Wizet",
      "artist": "StudioEIM",
      "title": "Final Fight",
      "year": "2004"
    },
    "source": {
      "client": "KMS",
      "date": "2004-10-25",
      "structure": "Bgm06",
      "version": "1.76"
    },
    "youtube": "rEtDrkAYs68"
  },
  {
    "description": "Ship to Ludibrium, Continental travel (Ossyria)",
    "filename": "FlyingInABlueDream",
    "mark": "Ludibrium",
    "metadata": {
      "albumArtist": "Wizet",
      "artist": "CODASOUND",
      "title": "Flying in a Blue Dream",
      "year": "2004"
    },
    "source": {
      "client": "KMS",
      "date": "2004-12-20",
      "structure": "Bgm06",
      "version": "1.81"
    },
    "youtube": "UywGQsCoj8c"
  },
  {
    "description": "El Nath: Zakum's Altar",
    "filename": "WelcomeToTheHell",
    "mark": "Zakum",
    "metadata": {
      "albumArtist": "Wizet",
      "artist": "StudioEIM",
      "title": "Welcome to Hell",
      "year": "2004"
    },
    "source": {
      "client": "KMS",
      "date": "2004-10-25",
      "structure": "Bgm06",
      "version": "1.76"
    },
    "youtube": "3EJFx4emHyk"
  }
]
