[
  {
    "description": "Yum Yum Island: Fungus Forest",
    "filename": "FungusForest",
    "mark": "YumYum",
    "metadata": {
      "albumArtist": "NECORD",
      "artist": "ASTERIA",
      "title": "Fungus Forest",
      "year": "2020"
    },
    "source": {
      "client": "KMST",
      "date": "2020-02-06",
      "structure": "Bgm54",
      "version": "1.2.098"
    },
    "youtube": "h3EKe2b5kYI"
  },
  {
    "description": "Yum Yum Island: Fungus Forest",
    "filename": "FungusForestB",
    "mark": "YumYum",
    "metadata": {
      "albumArtist": "NECORD",
      "artist": "ASTERIA",
      "title": "Fungus Forest -Ver. B-",
      "year": "2020"
    },
    "source": {
      "client": "KMST",
      "date": "2020-02-06",
      "structure": "Bgm54",
      "version": "1.2.098"
    },
    "youtube": "DrCzk_r0tUE"
  },
  {
    "description": "Yum Yum Island: Illiyard Field",
    "filename": "IlliyardMoor",
    "mark": "YumYum",
    "metadata": {
      "albumArtist": "NECORD",
      "artist": "ESTIMATE",
      "title": "Illiyard Moor",
      "year": "2020"
    },
    "source": {
      "client": "KMST",
      "date": "2020-02-06",
      "structure": "Bgm54",
      "version": "1.2.098"
    },
    "youtube": "GkJHzTUQdiU"
  },
  {
    "description": "Reverse City cutscene",
    "filename": "MemoryOfSunset",
    "mark": "Reverse_City",
    "metadata": {
      "albumArtist": "NECORD",
      "artist": "ASTERIA",
      "title": "Memory of Sunset",
      "year": "2019"
    },
    "source": {
      "client": "KMST",
      "date": "2019-12-12",
      "structure": "Bgm54",
      "version": "1.2.095"
    },
    "youtube": "eTneN70g90M"
  },
  {
    "description": "Yum Yum Island: Yum Yum Village",
    "filename": "MushbudForest",
    "mark": "YumYum",
    "metadata": {
      "albumArtist": "NECORD",
      "artist": "Initium SoundLab",
      "title": "Mushbud Forest",
      "year": "2020"
    },
    "source": {
      "client": "KMST",
      "date": "2020-02-06",
      "structure": "Bgm54",
      "version": "1.2.098"
    },
    "youtube": "TD0abMaS0Sk"
  },
  {
    "description": "Reverse City underground",
    "filename": "ReverseCity",
    "mark": "Reverse_City",
    "metadata": {
      "albumArtist": "NECORD",
      "artist": "ASTERIA",
      "title": "Reverse City",
      "year": "2019"
    },
    "source": {
      "client": "KMST",
      "date": "2019-12-12",
      "structure": "Bgm54",
      "version": "1.2.095"
    },
    "youtube": "Z5sInHxNTRg"
  },
  {
    "description": "Reverse City: M Tower",
    "filename": "ReverseCity2",
    "mark": "Reverse_City",
    "metadata": {
      "albumArtist": "NECORD",
      "artist": "ASTERIA",
      "title": "Reverse City 2",
      "year": "2019"
    },
    "source": {
      "client": "KMST",
      "date": "2019-12-12",
      "structure": "Bgm54",
      "version": "1.2.095"
    },
    "youtube": "CSAsQCLnB7U"
  },
  {
    "description": "Reverse City: M Tower boss theme",
    "filename": "T-bomb",
    "mark": "Reverse_City",
    "metadata": {
      "albumArtist": "NECORD",
      "artist": "ASTERIA",
      "title": "T-bomb",
      "year": "2019"
    },
    "source": {
      "client": "KMST",
      "date": "2019-12-12",
      "structure": "Bgm54",
      "version": "1.2.095"
    },
    "youtube": "b6k9HwW5EE0"
  }
]
