[
  {
    "description": "Nightmare Wonderland",
    "filename": "Ashes of spring",
    "mark": "nightmareParadise",
    "metadata": {
      "albumArtist": "NECORD",
      "artist": "ASTERIA",
      "title": "Ashes of Spring",
      "year": "2025"
    },
    "source": {
      "client": "KMST",
      "date": "2025-09-11",
      "structure": "Bgm61",
      "version": "1.2.193"
    },
    "youtube": "hcCWV0lqQgs"
  },
  {
    "description": "First Adversary - Phase 1",
    "filename": "Courage Unbreakable",
    "mark": "firstAdversary",
    "metadata": {
      "albumArtist": "NECORD",
      "artist": "ASTERIA",
      "title": "Courage Unbreakable",
      "year": "2025"
    },
    "source": {
      "client": "KMST",
      "date": "2025-08-14",
      "structure": "Bgm61",
      "version": "1.2.192"
    },
    "youtube": "IWXmRItfYsM"
  },
  {
    "description": "Nightmare Wonderland",
    "filename": "Feast of evil spirits",
    "mark": "nightmareParadise",
    "metadata": {
      "albumArtist": "NECORD",
      "artist": "ASTERIA",
      "title": "Feast of Evil Spirits",
      "year": "2025"
    },
    "source": {
      "client": "KMST",
      "date": "2025-09-11",
      "structure": "Bgm61",
      "version": "1.2.193"
    },
    "youtube": "-PLcCJV6s0g"
  },
  {
    "description": "First Adversary - Entrance",
    "filename": "Gate of Proof",
    "mark": "firstAdversary",
    "metadata": {
      "albumArtist": "NECORD",
      "artist": "ASTERIA",
      "title": "Gate of Proof",
      "year": "2025"
    },
    "source": {
      "client": "KMST",
      "date": "2025-08-14",
      "structure": "Bgm61",
      "version": "1.2.192"
    },
    "youtube": "_5r-2JTJowM"
  },
  {
    "description": "Vallora mountain zone",
    "filename": "If you follow the mountain path",
    "mark": "Vallora",
    "metadata": {
      "albumArtist": "NECORD",
      "artist": "ASTERIA",
      "title": "If You Follow the Mountain Path",
      "year": "2025"
    },
    "source": {
      "client": "KMST",
      "date": "2025-06-07",
      "structure": "Bgm61",
      "version": "1.2.188"
    },
    "youtube": "hLG-h805Wcc"
  },
  {
    "description": "Vallora",
    "filename": "Port city of Balora",
    "mark": "Vallora",
    "metadata": {
      "albumArtist": "NECORD",
      "artist": "ASTERIA",
      "title": "Port City of Vallora",
      "year": "2025"
    },
    "source": {
      "client": "KMST",
      "date": "2025-06-07",
      "structure": "Bgm61",
      "version": "1.2.188"
    },
    "youtube": "lyp4mlh3abI"
  },
  {
    "description": "Nightmare Wonderland storyline",
    "filename": "Rebirth of life",
    "mark": "nightmareParadise",
    "metadata": {
      "albumArtist": "NECORD",
      "artist": "ASTERIA",
      "title": "Rebirth of Life",
      "year": "2025"
    },
    "source": {
      "client": "KMST",
      "date": "2025-09-11",
      "structure": "Bgm61",
      "version": "1.2.193"
    },
    "youtube": "HlnALPLQut8"
  },
  {
    "description": "Vallora: Serpent's Lake",
    "filename": "Serpent's Lake",
    "mark": "Vallora",
    "metadata": {
      "albumArtist": "NECORD",
      "artist": "ASTERIA",
      "title": "Serpent's Lake",
      "year": "2025"
    },
    "source": {
      "client": "KMST",
      "date": "2025-06-07",
      "structure": "Bgm61",
      "version": "1.2.188"
    },
    "youtube": "ipl9FrvjEPU"
  },
  {
    "description": "First Adversary - Reward Map",
    "filename": "Succession Bloom",
    "mark": "firstAdversary",
    "metadata": {
      "albumArtist": "NECORD",
      "artist": "ASTERIA",
      "title": "Succession Bloom",
      "year": "2025"
    },
    "source": {
      "client": "KMST",
      "date": "2025-08-14",
      "structure": "Bgm61",
      "version": "1.2.192"
    },
    "youtube": "pevUhp_jxnU"
  },
  {
    "description": "Nightmare Wonderland",
    "filename": "The downfall",
    "mark": "nightmareParadise",
    "metadata": {
      "albumArtist": "NECORD",
      "artist": "ASTERIA",
      "title": "The Downfall",
      "year": "2025"
    },
    "source": {
      "client": "KMST",
      "date": "2025-09-11",
      "structure": "Bgm61",
      "version": "1.2.193"
    },
    "youtube": "rP5UgQ71d14"
  },
  {
    "description": "First Adversary - Phase 3",
    "filename": "Voice of Verdict",
    "mark": "firstAdversary",
    "metadata": {
      "albumArtist": "NECORD",
      "artist": "ASTERIA",
      "title": "Voice of Verdict",
      "year": "2025"
    },
    "source": {
      "client": "KMST",
      "date": "2025-08-14",
      "structure": "Bgm61",
      "version": "1.2.192"
    },
    "youtube": "3xpCpPHwsQ0"
  },
  {
    "description": "Len storyline",
    "filename": "When the wind blows",
    "mark": "Vallora",
    "metadata": {
      "albumArtist": "NECORD",
      "artist": "ASTERIA",
      "title": "When the Wind Blows",
      "year": "2025"
    },
    "source": {
      "client": "KMST",
      "date": "2025-06-07",
      "structure": "Bgm61",
      "version": "1.2.188"
    },
    "youtube": "ArFkvhHvLsE"
  },
  {
    "description": "Vallora beach zone",
    "filename": "Wind flowing in the harbor",
    "mark": "Vallora",
    "metadata": {
      "albumArtist": "NECORD",
      "artist": "ASTERIA",
      "title": "Wind Flowing in the Harbor",
      "year": "2025"
    },
    "source": {
      "client": "KMST",
      "date": "2025-06-07",
      "structure": "Bgm61",
      "version": "1.2.188"
    },
    "youtube": "mKhyvIKVW18"
  },
  {
    "description": "First Adversary - Phase 2",
    "filename": "Wisdom Beyond Aspirations",
    "mark": "firstAdversary",
    "metadata": {
      "albumArtist": "NECORD",
      "artist": "ASTERIA",
      "title": "Wisdom Beyond Aspirations",
      "year": "2025"
    },
    "source": {
      "client": "KMST",
      "date": "2025-08-14",
      "structure": "Bgm61",
      "version": "1.2.192"
    },
    "youtube": "OeKYxq_TX_Y"
  }
]
