[
  {
    "description": "Odium: Occupied Alley",
    "filename": "Alley on the Other Side",
    "mark": "odium",
    "metadata": {
      "albumArtist": "NECORD",
      "artist": "ASTERIA",
      "title": "Alley on the Other Side",
      "year": "2022"
    },
    "source": {
      "client": "KMST",
      "date": "2022-08-18",
      "structure": "Bgm58",
      "version": "1.2.145"
    },
    "youtube": "Dhoag52TV_w"
  },
  {
    "description": "Explorer storyline",
    "filename": "Endless Curse",
    "mark": "MushroomVillage",
    "metadata": {
      "albumArtist": "NECORD",
      "artist": "ASTERIA",
      "title": "Endless Curse",
      "year": "2022"
    },
    "source": {
      "client": "KMST",
      "date": "2022-01-18",
      "structure": "Bgm58",
      "version": "1.2.136"
    },
    "youtube": "UwuyxDRPkmI"
  },
  {
    "description": "Odium storyline",
    "filename": "Four Perils Astray",
    "mark": "odium",
    "metadata": {
      "albumArtist": "NECORD",
      "artist": "ASTERIA",
      "title": "Four Perils Astray",
      "year": "2022"
    },
    "source": {
      "client": "KMST",
      "date": "2022-08-18",
      "structure": "Bgm58",
      "version": "1.2.145"
    },
    "youtube": "Orjgsq8R-CU"
  },
  {
    "description": "Odium: Laboratory Behind Locked Doors",
    "filename": "Irreversible Abomination",
    "mark": "odium",
    "metadata": {
      "albumArtist": "NECORD",
      "artist": "ASTERIA",
      "title": "Irreversible Abomination",
      "year": "2022"
    },
    "source": {
      "client": "KMST",
      "date": "2022-08-18",
      "structure": "Bgm58",
      "version": "1.2.145"
    },
    "youtube": "XCg3agTZ7t8"
  },
  {
    "description": "Explorer storyline - character progression",
    "filename": "Just Another Maple Leaf",
    "mark": "MushroomVillage",
    "metadata": {
      "albumArtist": "NECORD",
      "artist": "ASTERIA",
      "title": "Just Another Maple Leaf",
      "year": "2022"
    },
    "source": {
      "client": "KMST",
      "date": "2022-01-18",
      "structure": "Bgm58",
      "version": "1.2.136"
    },
    "youtube": "7NN_k0auDWQ"
  },
  {
    "description": "Cygnus Knights - Mihile storyline",
    "filename": "Knight of Light",
    "mark": "Ereb",
    "metadata": {
      "albumArtist": "NECORD",
      "artist": "ASTERIA",
      "title": "Knight of Light",
      "year": "2022"
    },
    "source": {
      "client": "KMST",
      "date": "2022-06-23",
      "structure": "Bgm58",
      "version": "1.2.143"
    },
    "youtube": "_e9YXlxlCqA"
  },
  {
    "description": "Ereve: Nobleman's Estate",
    "filename": "Noblesse nostalgia",
    "mark": "Ereb",
    "metadata": {
      "albumArtist": "NECORD",
      "artist": "ASTERIA",
      "title": "Noblesse Nostalgia",
      "year": "2022"
    },
    "source": {
      "client": "KMST",
      "date": "2022-06-23",
      "structure": "Bgm58",
      "version": "1.2.143"
    },
    "youtube": "u2TQ4DFqSSw"
  },
  {
    "description": "Cygnus Knights storyline - God's Shelter",
    "filename": "Resting place of God",
    "mark": "Ereb",
    "metadata": {
      "albumArtist": "NECORD",
      "artist": "ASTERIA",
      "title": "Resting Place of God",
      "year": "2022"
    },
    "source": {
      "client": "KMST",
      "date": "2022-06-23",
      "structure": "Bgm58",
      "version": "1.2.143"
    },
    "youtube": "QstADc5R4GI"
  },
  {
    "description": "Odium: Sunny Laboratory",
    "filename": "Sunshine blurring the Unknown",
    "mark": "odium",
    "metadata": {
      "albumArtist": "NECORD",
      "artist": "ASTERIA",
      "title": "Sunshine Blurring the Unknown",
      "year": "2022"
    },
    "source": {
      "client": "KMST",
      "date": "2022-08-18",
      "structure": "Bgm58",
      "version": "1.2.145"
    },
    "youtube": "N2dyV-2UeK8"
  },
  {
    "description": "Maple Island",
    "filename": "The Beginnig of The Adventure",
    "mark": "MushroomVillage",
    "metadata": {
      "albumArtist": "NECORD",
      "artist": "ASTERIA",
      "title": "The Beginning of the Adventure",
      "year": "2022"
    },
    "source": {
      "client": "KMST",
      "date": "2022-01-18",
      "structure": "Bgm58",
      "version": "1.2.136"
    },
    "youtube": "-bSIQVSEdgM"
  },
  {
    "description": "Odium",
    "filename": "The Lost City among the Clouds",
    "mark": "odium",
    "metadata": {
      "albumArtist": "NECORD",
      "artist": "ASTERIA",
      "title": "The Lost City Among the Clouds",
      "year": "2022"
    },
    "source": {
      "client": "KMST",
      "date": "2022-08-18",
      "structure": "Bgm58",
      "version": "1.2.145"
    },
    "youtube": "34Tb70dLN3Q"
  },
  {
    "description": "Grand Athenaeum: Maple Chronicles",
    "filename": "The other side of the dimension",
    "mark": "Library",
    "metadata": {
      "albumArtist": "NECORD",
      "artist": "ASTERIA",
      "title": "The Other Side of the Dimension",
      "year": "2022"
    },
    "source": {
      "client": "KMST",
      "date": "2022-10-20",
      "structure": "Bgm58",
      "version": "1.2.147"
    },
    "youtube": "1dUnek_TBRk"
  },
  {
    "description": "Monster Park Extreme",
    "filename": "Warning! Unknown Area",
    "mark": "Carnival",
    "metadata": {
      "albumArtist": "NECORD",
      "artist": "ASTERIA",
      "title": "Warning! Unknown Area",
      "year": "2022"
    },
    "source": {
      "client": "KMS",
      "date": "2022-07-28",
      "structure": "Bgm58",
      "version": "1.2.367"
    },
    "youtube": "Nkh_YN1PRP4"
  }
]
