[
  {
    "description": "Shade tutorial",
    "filename": "decision",
    "mark": "TimeTemple",
    "metadata": {
      "albumArtist": "Wizet",
      "artist": "StudioEIM",
      "title": "Decision",
      "year": "2013"
    },
    "source": {
      "client": "KMST",
      "date": "2013-12-23",
      "structure": "Bgm36",
      "version": "1.2.494"
    },
    "youtube": "fajX5WR07mw"
  },
  {
    "description": "Night Walker's Dominion skill",
    "filename": "Dominion",
    "mark": "Ereb",
    "metadata": {
      "albumArtist": "Wizet",
      "artist": "StudioEIM",
      "title": "Dominion",
      "year": "2014"
    },
    "source": {
      "client": "KMST",
      "date": "2014-04-10",
      "structure": "Bgm36",
      "version": "1.2.501"
    },
    "youtube": "Or2OSeGbPV0"
  },
  {
    "description": "Fox Point Village",
    "filename": "foxvillage",
    "mark": "foxvillage",
    "metadata": {
      "albumArtist": "Wizet",
      "artist": "StudioEIM",
      "title": "Fox Village",
      "year": "2013"
    },
    "source": {
      "client": "KMST",
      "date": "2013-12-09",
      "structure": "Bgm36",
      "version": "1.2.493"
    },
    "youtube": "lorm88ckSuM"
  },
  {
    "description": "11th anniversary festival",
    "filename": "HappyTimeLong",
    "mark": "MinigameStation",
    "metadata": {
      "albumArtist": "Wizet",
      "artist": "StudioEIM",
      "title": "Happy Time",
      "year": "2013"
    },
    "source": {
      "client": "KMST",
      "date": "2013-12-09",
      "structure": "Bgm36",
      "version": "1.2.493"
    },
    "youtube": "wzBIoro1jIs"
  },
  {
    "description": "Elite Boss bonus stage",
    "filename": "HappyTimeShort",
    "mark": "FreeMarket",
    "metadata": {
      "albumArtist": "Wizet",
      "artist": "StudioEIM",
      "title": "Happy Time (Short Version)",
      "year": "2013"
    },
    "source": {
      "client": "KMS",
      "date": "2013-12-19",
      "structure": "Bgm36",
      "version": "1.2.206"
    },
    "youtube": "RknHVs7vDlw"
  },
  {
    "description": "Shade's Reincarnated Fox God skill",
    "filename": "LightOfTheFoxGoddess",
    "mark": "foxvillage",
    "metadata": {
      "albumArtist": "NECORD",
      "artist": "ASTERIA",
      "title": "Forgotten Radiance",
      "year": "2024"
    },
    "source": {
      "client": "KMST",
      "date": "2024-06-08",
      "structure": "Bgm36",
      "version": "1.2.174"
    },
    "youtube": "SfnK7L_rHaU"
  },
  {
    "description": "Elite Boss theme",
    "filename": "RoyalGuard",
    "mark": "FreeMarket",
    "metadata": {
      "albumArtist": "Wizet",
      "artist": "StudioEIM",
      "title": "Royal Guard",
      "year": "2013"
    },
    "source": {
      "client": "KMST",
      "date": "2013-12-09",
      "structure": "Bgm36",
      "version": "1.2.493"
    },
    "youtube": "ui4YM2l2i4o"
  },
  {
    "description": "Rainy Fox Point Village",
    "filename": "sadfoxvillage",
    "mark": "foxvillage",
    "metadata": {
      "albumArtist": "Wizet",
      "artist": "StudioEIM",
      "title": "Sad Fox Village",
      "year": "2013"
    },
    "source": {
      "client": "KMST",
      "date": "2013-12-23",
      "structure": "Bgm36",
      "version": "1.2.494"
    },
    "youtube": "4oNXYkRrf-g"
  }
]
